id,title,pdf_path,year
0706.3188v1,A tutorial on conformal prediction,/Users/isabeldinan/01 Python/Info Retrieval/project/downloaded_pdfs/0706.3188v1.pdf,2007
0802.1244v1,Learning Balanced Mixtures of Discrete Distributions with Small Sample,/Users/isabeldinan/01 Python/Info Retrieval/project/downloaded_pdfs/0802.1244v1.pdf,2008
0809.1493v1,"Exploring Large Feature Spaces with Hierarchical Multiple Kernel
  Learning",/Users/isabeldinan/01 Python/Info Retrieval/project/downloaded_pdfs/0809.1493v1.pdf,2008
0901.3150v4,Matrix Completion from a Few Entries,/Users/isabeldinan/01 Python/Info Retrieval/project/downloaded_pdfs/0901.3150v4.pdf,2009
0901.3202v1,Model-Consistent Sparse Estimation through the Bootstrap,/Users/isabeldinan/01 Python/Info Retrieval/project/downloaded_pdfs/0901.3202v1.pdf,2009
0902.0392v2,Tree Exploration for Bayesian RL Exploration,/Users/isabeldinan/01 Python/Info Retrieval/project/downloaded_pdfs/0902.0392v2.pdf,2009
0903.5328v1,A Stochastic View of Optimal Regret through Minimax Duality,/Users/isabeldinan/01 Python/Info Retrieval/project/downloaded_pdfs/0903.5328v1.pdf,2009
0904.0776v1,"Induction of High-level Behaviors from Problem-solving Traces using
  Machine Learning Tools",/Users/isabeldinan/01 Python/Info Retrieval/project/downloaded_pdfs/0904.0776v1.pdf,2009
0906.2027v2,Matrix Completion from Noisy Entries,/Users/isabeldinan/01 Python/Info Retrieval/project/downloaded_pdfs/0906.2027v2.pdf,2009
0908.0570v1,The Infinite Hierarchical Factor Regression Model,/Users/isabeldinan/01 Python/Info Retrieval/project/downloaded_pdfs/0908.0570v1.pdf,2009
0908.0572v1,Streamed Learning: One-Pass SVMs,/Users/isabeldinan/01 Python/Info Retrieval/project/downloaded_pdfs/0908.0572v1.pdf,2009
0910.0610v2,Regularization Techniques for Learning with Matrices,/Users/isabeldinan/01 Python/Info Retrieval/project/downloaded_pdfs/0910.0610v2.pdf,2009
0911.0054v2,"Learning Exponential Families in High-Dimensions: Strong Convexity and
  Sparsity",/Users/isabeldinan/01 Python/Info Retrieval/project/downloaded_pdfs/0911.0054v2.pdf,2009
0912.1128v1,How to Explain Individual Classification Decisions,/Users/isabeldinan/01 Python/Info Retrieval/project/downloaded_pdfs/0912.1128v1.pdf,2009
1002.4802v2,Gaussian Process Structural Equation Models with Latent Variables,/Users/isabeldinan/01 Python/Info Retrieval/project/downloaded_pdfs/1002.4802v2.pdf,2010
1003.0079v3,Non-Sparse Regularization for Multiple Kernel Learning,/Users/isabeldinan/01 Python/Info Retrieval/project/downloaded_pdfs/1003.0079v3.pdf,2010
1003.4944v1,"Incorporating Side Information in Probabilistic Matrix Factorization
  with Gaussian Processes",/Users/isabeldinan/01 Python/Info Retrieval/project/downloaded_pdfs/1003.4944v1.pdf,2010
1004.0456v1,"Exploratory Analysis of Functional Data via Clustering and Optimal
  Segmentation",/Users/isabeldinan/01 Python/Info Retrieval/project/downloaded_pdfs/1004.0456v1.pdf,2010
1005.0188v1,Generative and Latent Mean Map Kernels,/Users/isabeldinan/01 Python/Info Retrieval/project/downloaded_pdfs/1005.0188v1.pdf,2010
1005.0437v1,A Unifying View of Multiple Kernel Learning,/Users/isabeldinan/01 Python/Info Retrieval/project/downloaded_pdfs/1005.0437v1.pdf,2010
1005.2263v2,Context models on sequences of covers,/Users/isabeldinan/01 Python/Info Retrieval/project/downloaded_pdfs/1005.2263v2.pdf,2010
1005.5337v1,Using a Kernel Adatron for Object Classification with RCS Data,/Users/isabeldinan/01 Python/Info Retrieval/project/downloaded_pdfs/1005.5337v1.pdf,2010
1006.1138v3,Online Learning via Sequential Complexities,/Users/isabeldinan/01 Python/Info Retrieval/project/downloaded_pdfs/1006.1138v3.pdf,2010
1006.5051v1,Fast ABC-Boost for Multi-Class Classification,/Users/isabeldinan/01 Python/Info Retrieval/project/downloaded_pdfs/1006.5051v1.pdf,2010
1007.3564v3,Manifold Elastic Net: A Unified Framework for Sparse Dimension Reduction,/Users/isabeldinan/01 Python/Info Retrieval/project/downloaded_pdfs/1007.3564v3.pdf,2010
1008.4000v1,NESVM: a Fast Gradient Method for Support Vector Machines,/Users/isabeldinan/01 Python/Info Retrieval/project/downloaded_pdfs/1008.4000v1.pdf,2010
1008.5209v1,Network Flow Algorithms for Structured Sparsity,/Users/isabeldinan/01 Python/Info Retrieval/project/downloaded_pdfs/1008.5209v1.pdf,2010
1008.5386v1,Mixed Cumulative Distribution Networks,/Users/isabeldinan/01 Python/Info Retrieval/project/downloaded_pdfs/1008.5386v1.pdf,2010
1009.3958v1,Approximate Inference and Stochastic Optimal Control,/Users/isabeldinan/01 Python/Info Retrieval/project/downloaded_pdfs/1009.3958v1.pdf,2010
1011.3090v2,Regularization Strategies and Empirical Bayesian Learning for MKL,/Users/isabeldinan/01 Python/Info Retrieval/project/downloaded_pdfs/1011.3090v2.pdf,2010
1011.5270v2,Classifying Clustering Schemes,/Users/isabeldinan/01 Python/Info Retrieval/project/downloaded_pdfs/1011.5270v2.pdf,2010
1011.5395v1,The Sample Complexity of Dictionary Learning,/Users/isabeldinan/01 Python/Info Retrieval/project/downloaded_pdfs/1011.5395v1.pdf,2010
1011.6086v1,"In All Likelihood, Deep Belief Is Not Enough",/Users/isabeldinan/01 Python/Info Retrieval/project/downloaded_pdfs/1011.6086v1.pdf,2010
1012.0975v2,"Split Bregman Method for Sparse Inverse Covariance Estimation with
  Matrix Iteration Acceleration",/Users/isabeldinan/01 Python/Info Retrieval/project/downloaded_pdfs/1012.0975v2.pdf,2010
1012.1501v2,Shaping Level Sets with Submodular Functions,/Users/isabeldinan/01 Python/Info Retrieval/project/downloaded_pdfs/1012.1501v2.pdf,2010
1102.3923v2,Concentration-Based Guarantees for Low-Rank Matrix Reconstruction,/Users/isabeldinan/01 Python/Info Retrieval/project/downloaded_pdfs/1102.3923v2.pdf,2011
1102.3949v2,"Sparse Signal Recovery with Temporally Correlated Source Vectors Using
  Sparse Bayesian Learning",/Users/isabeldinan/01 Python/Info Retrieval/project/downloaded_pdfs/1102.3949v2.pdf,2011
1103.0102v2,Multi-label Learning via Structured Decomposition and Group Sparsity,/Users/isabeldinan/01 Python/Info Retrieval/project/downloaded_pdfs/1103.0102v2.pdf,2011
1103.0942v2,Generalization error bounds for stationary autoregressive models,/Users/isabeldinan/01 Python/Info Retrieval/project/downloaded_pdfs/1103.0942v2.pdf,2011
1103.3095v1,A note on active learning for smooth problems,/Users/isabeldinan/01 Python/Info Retrieval/project/downloaded_pdfs/1103.3095v1.pdf,2011
1103.4480v1,Clustered regression with unknown clusters,/Users/isabeldinan/01 Python/Info Retrieval/project/downloaded_pdfs/1103.4480v1.pdf,2011
1103.4896v1,Classification of Sets using Restricted Boltzmann Machines,/Users/isabeldinan/01 Python/Info Retrieval/project/downloaded_pdfs/1103.4896v1.pdf,2011
1104.0729v4,Online and Batch Learning Algorithms for Data with Missing Features,/Users/isabeldinan/01 Python/Info Retrieval/project/downloaded_pdfs/1104.0729v4.pdf,2011
1104.1990v3,Adaptive Evolutionary Clustering,/Users/isabeldinan/01 Python/Info Retrieval/project/downloaded_pdfs/1104.1990v3.pdf,2011
1104.4512v1,Robust Clustering Using Outlier-Sparsity Regularization,/Users/isabeldinan/01 Python/Info Retrieval/project/downloaded_pdfs/1104.4512v1.pdf,2011
1104.4803v4,Clustering Partially Observed Graphs via Convex Optimization,/Users/isabeldinan/01 Python/Info Retrieval/project/downloaded_pdfs/1104.4803v4.pdf,2011
1104.5687v2,Preference elicitation and inverse reinforcement learning,/Users/isabeldinan/01 Python/Info Retrieval/project/downloaded_pdfs/1104.5687v2.pdf,2011
1105.0382v1,Rapid Learning with Stochastic Focus of Attention,/Users/isabeldinan/01 Python/Info Retrieval/project/downloaded_pdfs/1105.0382v1.pdf,2011
1105.0540v2,Pruning nearest neighbor cluster trees,/Users/isabeldinan/01 Python/Info Retrieval/project/downloaded_pdfs/1105.0540v2.pdf,2011
1105.2054v2,Generalized Boosting Algorithms for Convex Optimization,/Users/isabeldinan/01 Python/Info Retrieval/project/downloaded_pdfs/1105.2054v2.pdf,2011
1105.2416v2,PAC-Bayesian Analysis of Martingales and Multiarmed Bandits,/Users/isabeldinan/01 Python/Info Retrieval/project/downloaded_pdfs/1105.2416v2.pdf,2011
1105.4585v1,PAC-Bayesian Analysis of the Exploration-Exploitation Trade-off,/Users/isabeldinan/01 Python/Info Retrieval/project/downloaded_pdfs/1105.4585v1.pdf,2011
1106.0730v2,Rademacher complexity of stationary sequences,/Users/isabeldinan/01 Python/Info Retrieval/project/downloaded_pdfs/1106.0730v2.pdf,2011
1106.0800v3,Optimal Reinforcement Learning for Gaussian Systems,/Users/isabeldinan/01 Python/Info Retrieval/project/downloaded_pdfs/1106.0800v3.pdf,2011
1106.0967v1,Hashing Algorithms for Large-Scale Learning,/Users/isabeldinan/01 Python/Info Retrieval/project/downloaded_pdfs/1106.0967v1.pdf,2011
1106.1216v2,Using More Data to Speed-up Training Time,/Users/isabeldinan/01 Python/Info Retrieval/project/downloaded_pdfs/1106.1216v2.pdf,2011
1106.1622v1,Large-Scale Convex Minimization with a Low-Rank Constraint,/Users/isabeldinan/01 Python/Info Retrieval/project/downloaded_pdfs/1106.1622v1.pdf,2011
1106.2429v4,Efficient Transductive Online Learning via Randomized Rounding,/Users/isabeldinan/01 Python/Info Retrieval/project/downloaded_pdfs/1106.2429v4.pdf,2011
1106.2436v3,From Bandits to Experts: On the Value of Side-Observations,/Users/isabeldinan/01 Python/Info Retrieval/project/downloaded_pdfs/1106.2436v3.pdf,2011
1106.3651v2,Robust Bayesian reinforcement learning through tight lower bounds,/Users/isabeldinan/01 Python/Info Retrieval/project/downloaded_pdfs/1106.3651v2.pdf,2011
1106.4251v1,"Learning with the Weighted Trace-norm under Arbitrary Sampling
  Distributions",/Users/isabeldinan/01 Python/Info Retrieval/project/downloaded_pdfs/1106.4251v1.pdf,2011
1106.4355v3,Tight Measurement Bounds for Exact Recovery of Structured Sparse Signals,/Users/isabeldinan/01 Python/Info Retrieval/project/downloaded_pdfs/1106.4355v3.pdf,2011
1106.5236v1,A General Framework for Structured Sparsity via Proximal Optimization,/Users/isabeldinan/01 Python/Info Retrieval/project/downloaded_pdfs/1106.5236v1.pdf,2011
1107.1283v2,Spectral Methods for Learning Multivariate Latent Tree Structure,/Users/isabeldinan/01 Python/Info Retrieval/project/downloaded_pdfs/1107.1283v2.pdf,2011
1107.2021v3,Multi-Instance Learning with Any Hypothesis Class,/Users/isabeldinan/01 Python/Info Retrieval/project/downloaded_pdfs/1107.2021v3.pdf,2011
1107.2462v2,Statistical Topic Models for Multi-Label Document Classification,/Users/isabeldinan/01 Python/Info Retrieval/project/downloaded_pdfs/1107.2462v2.pdf,2011
1107.3600v2,Unsupervised K-Nearest Neighbor Regression,/Users/isabeldinan/01 Python/Info Retrieval/project/downloaded_pdfs/1107.3600v2.pdf,2011
1108.2820v2,Ensemble Risk Modeling Method for Robust Learning on Scarce Data,/Users/isabeldinan/01 Python/Info Retrieval/project/downloaded_pdfs/1108.2820v2.pdf,2011
1108.3154v2,Stability Conditions for Online Learnability,/Users/isabeldinan/01 Python/Info Retrieval/project/downloaded_pdfs/1108.3154v2.pdf,2011
1108.3476v2,Structured Sparsity and Generalization,/Users/isabeldinan/01 Python/Info Retrieval/project/downloaded_pdfs/1108.3476v2.pdf,2011
1109.0455v1,Gradient-based kernel dimension reduction for supervised learning,/Users/isabeldinan/01 Python/Info Retrieval/project/downloaded_pdfs/1109.0455v1.pdf,2011
1109.0895v1,"Nonlinear Channel Estimation for OFDM System by Complex LS-SVM under
  High Mobility Conditions",/Users/isabeldinan/01 Python/Info Retrieval/project/downloaded_pdfs/1109.0895v1.pdf,2011
1109.1990v1,Trace Lasso: a trace norm regularization for correlated designs,/Users/isabeldinan/01 Python/Info Retrieval/project/downloaded_pdfs/1109.1990v1.pdf,2011
1109.2397v2,Structured sparsity through convex optimization,/Users/isabeldinan/01 Python/Info Retrieval/project/downloaded_pdfs/1109.2397v2.pdf,2011
1109.3248v1,Reconstruction of sequential data with density models,/Users/isabeldinan/01 Python/Info Retrieval/project/downloaded_pdfs/1109.3248v1.pdf,2011
1109.5311v1,Bias Plus Variance Decomposition for Survival Analysis Problems,/Users/isabeldinan/01 Python/Info Retrieval/project/downloaded_pdfs/1109.5311v1.pdf,2011
1109.5894v1,Learning Item Trees for Probabilistic Modelling of Implicit Feedback,/Users/isabeldinan/01 Python/Info Retrieval/project/downloaded_pdfs/1109.5894v1.pdf,2011
1110.0413v1,Group Lasso with Overlaps: the Latent Group Lasso approach,/Users/isabeldinan/01 Python/Info Retrieval/project/downloaded_pdfs/1110.0413v1.pdf,2011
1110.3076v1,"Efficient Latent Variable Graphical Model Selection via Split Bregman
  Method",/Users/isabeldinan/01 Python/Info Retrieval/project/downloaded_pdfs/1110.3076v1.pdf,2011
1110.4198v3,A Reliable Effective Terascale Linear Learning System,/Users/isabeldinan/01 Python/Info Retrieval/project/downloaded_pdfs/1110.4198v3.pdf,2011
1110.4322v3,An Optimal Algorithm for Linear Bandits,/Users/isabeldinan/01 Python/Info Retrieval/project/downloaded_pdfs/1110.4322v3.pdf,2011
1110.4713v1,Kernel Topic Models,/Users/isabeldinan/01 Python/Info Retrieval/project/downloaded_pdfs/1110.4713v1.pdf,2011
1111.0352v2,Revisiting k-means: New Algorithms via Bayesian Nonparametrics,/Users/isabeldinan/01 Python/Info Retrieval/project/downloaded_pdfs/1111.0352v2.pdf,2011
1111.5479v2,The Graphical Lasso: New Insights and Alternatives,/Users/isabeldinan/01 Python/Info Retrieval/project/downloaded_pdfs/1111.5479v2.pdf,2011
1111.6201v4,Learning a Factor Model via Regularized PCA,/Users/isabeldinan/01 Python/Info Retrieval/project/downloaded_pdfs/1111.6201v4.pdf,2011
1111.6473v1,A kernel-based framework for learning graded relations from data,/Users/isabeldinan/01 Python/Info Retrieval/project/downloaded_pdfs/1111.6473v1.pdf,2011
1111.6925v1,"Structure Learning of Probabilistic Graphical Models: A Comprehensive
  Survey",/Users/isabeldinan/01 Python/Info Retrieval/project/downloaded_pdfs/1111.6925v1.pdf,2011
1112.1556v3,Active Learning of Halfspaces under a Margin Assumption,/Users/isabeldinan/01 Python/Info Retrieval/project/downloaded_pdfs/1112.1556v3.pdf,2011
1112.2738v1,Robust Learning via Cause-Effect Models,/Users/isabeldinan/01 Python/Info Retrieval/project/downloaded_pdfs/1112.2738v1.pdf,2011
1112.4394v1,Additive Gaussian Processes,/Users/isabeldinan/01 Python/Info Retrieval/project/downloaded_pdfs/1112.4394v1.pdf,2011
1112.4607v1,Alignment Based Kernel Learning with a Continuous Set of Base Kernels,/Users/isabeldinan/01 Python/Info Retrieval/project/downloaded_pdfs/1112.4607v1.pdf,2011
1112.5404v1,Similarity-based Learning via Data Driven Embeddings,/Users/isabeldinan/01 Python/Info Retrieval/project/downloaded_pdfs/1112.5404v1.pdf,2011
1112.5627v1,Minimax Rates for Homology Inference,/Users/isabeldinan/01 Python/Info Retrieval/project/downloaded_pdfs/1112.5627v1.pdf,2011
1112.5745v1,Bayesian Active Learning for Classification and Preference Learning,/Users/isabeldinan/01 Python/Info Retrieval/project/downloaded_pdfs/1112.5745v1.pdf,2011
1201.0610v1,"Random Forests for Metric Learning with Implicit Pairwise Position
  Dependence",/Users/isabeldinan/01 Python/Info Retrieval/project/downloaded_pdfs/1201.0610v1.pdf,2012
1201.0959v1,"Constrained variable clustering and the best basis problem in functional
  data analysis",/Users/isabeldinan/01 Python/Info Retrieval/project/downloaded_pdfs/1201.0959v1.pdf,2012
1201.0963v1,Clustering Dynamic Web Usage Data,/Users/isabeldinan/01 Python/Info Retrieval/project/downloaded_pdfs/1201.0963v1.pdf,2012
1201.1450v1,"The Interaction of Entropy-Based Discretization and Sample Size: An
  Empirical Study",/Users/isabeldinan/01 Python/Info Retrieval/project/downloaded_pdfs/1201.1450v1.pdf,2012
1201.2555v2,Sparse Reward Processes,/Users/isabeldinan/01 Python/Info Retrieval/project/downloaded_pdfs/1201.2555v2.pdf,2012
1201.3382v2,Spike-and-Slab Sparse Coding for Unsupervised Feature Discovery,/Users/isabeldinan/01 Python/Info Retrieval/project/downloaded_pdfs/1201.3382v2.pdf,2012
1201.4714v1,A metric learning perspective of SVM: on the relation of SVM and LMNN,/Users/isabeldinan/01 Python/Info Retrieval/project/downloaded_pdfs/1201.4714v1.pdf,2012
1201.5338v2,On Constrained Spectral Clustering and Its Applications,/Users/isabeldinan/01 Python/Info Retrieval/project/downloaded_pdfs/1201.5338v2.pdf,2012
1202.0302v3,Kernels on Sample Sets via Nonparametric Divergence Estimates,/Users/isabeldinan/01 Python/Info Retrieval/project/downloaded_pdfs/1202.0302v3.pdf,2012
1202.0855v1,"A Reconstruction Error Formulation for Semi-Supervised Multi-task and
  Multi-view Learning",/Users/isabeldinan/01 Python/Info Retrieval/project/downloaded_pdfs/1202.0855v1.pdf,2012
1202.1119v2,Cramer Rao-Type Bounds for Sparse Bayesian Learning,/Users/isabeldinan/01 Python/Info Retrieval/project/downloaded_pdfs/1202.1119v2.pdf,2012
1202.1121v2,"rFerns: An Implementation of the Random Ferns Method for General-Purpose
  Machine Learning",/Users/isabeldinan/01 Python/Info Retrieval/project/downloaded_pdfs/1202.1121v2.pdf,2012
1202.1523v1,Information Forests,/Users/isabeldinan/01 Python/Info Retrieval/project/downloaded_pdfs/1202.1523v1.pdf,2012
1202.3079v1,"Towards minimax policies for online linear optimization with bandit
  feedback",/Users/isabeldinan/01 Python/Info Retrieval/project/downloaded_pdfs/1202.3079v1.pdf,2012
1202.3323v2,Mirror Descent Meets Fixed Share (and feels no regret),/Users/isabeldinan/01 Python/Info Retrieval/project/downloaded_pdfs/1202.3323v2.pdf,2012
1202.3702v1,Semi-supervised Learning with Density Based Distances,/Users/isabeldinan/01 Python/Info Retrieval/project/downloaded_pdfs/1202.3702v1.pdf,2012
1202.3704v1,Near-Optimal Target Learning With Stochastic Binary Signals,/Users/isabeldinan/01 Python/Info Retrieval/project/downloaded_pdfs/1202.3704v1.pdf,2012
1202.3708v1,"Smoothing Proximal Gradient Method for General Structured Sparse
  Learning",/Users/isabeldinan/01 Python/Info Retrieval/project/downloaded_pdfs/1202.3708v1.pdf,2012
1202.3712v1,Ensembles of Kernel Predictors,/Users/isabeldinan/01 Python/Info Retrieval/project/downloaded_pdfs/1202.3712v1.pdf,2012
1202.3714v1,Active Learning for Developing Personalized Treatment,/Users/isabeldinan/01 Python/Info Retrieval/project/downloaded_pdfs/1202.3714v1.pdf,2012
1202.3716v1,Boosting as a Product of Experts,/Users/isabeldinan/01 Python/Info Retrieval/project/downloaded_pdfs/1202.3716v1.pdf,2012
1202.3717v1,PAC-Bayesian Policy Evaluation for Reinforcement Learning,/Users/isabeldinan/01 Python/Info Retrieval/project/downloaded_pdfs/1202.3717v1.pdf,2012
1202.3725v1,Generalized Fisher Score for Feature Selection,/Users/isabeldinan/01 Python/Info Retrieval/project/downloaded_pdfs/1202.3725v1.pdf,2012
1202.3726v1,Active Semi-Supervised Learning using Submodular Functions,/Users/isabeldinan/01 Python/Info Retrieval/project/downloaded_pdfs/1202.3726v1.pdf,2012
1202.3727v1,"Bregman divergence as general framework to estimate unnormalized
  statistical models",/Users/isabeldinan/01 Python/Info Retrieval/project/downloaded_pdfs/1202.3727v1.pdf,2012
1202.3730v1,Sequential Inference for Latent Force Models,/Users/isabeldinan/01 Python/Info Retrieval/project/downloaded_pdfs/1202.3730v1.pdf,2012
1202.3731v1,What Cannot be Learned with Bethe Approximations,/Users/isabeldinan/01 Python/Info Retrieval/project/downloaded_pdfs/1202.3731v1.pdf,2012
1202.3733v1,Lipschitz Parametrization of Probabilistic Graphical Models,/Users/isabeldinan/01 Python/Info Retrieval/project/downloaded_pdfs/1202.3733v1.pdf,2012
1202.3735v1,Noisy-OR Models with Latent Confounding,/Users/isabeldinan/01 Python/Info Retrieval/project/downloaded_pdfs/1202.3735v1.pdf,2012
1202.3736v1,Discovering causal structures in binary exclusive-or skew acyclic models,/Users/isabeldinan/01 Python/Info Retrieval/project/downloaded_pdfs/1202.3736v1.pdf,2012
1202.3737v1,Detecting low-complexity unobserved causes,/Users/isabeldinan/01 Python/Info Retrieval/project/downloaded_pdfs/1202.3737v1.pdf,2012
1202.3746v1,"Asymptotic Efficiency of Deterministic Estimators for Discrete
  Energy-Based Models: Ratio Matching and Pseudolikelihood",/Users/isabeldinan/01 Python/Info Retrieval/project/downloaded_pdfs/1202.3746v1.pdf,2012
1202.3747v1,Reconstructing Pompeian Households,/Users/isabeldinan/01 Python/Info Retrieval/project/downloaded_pdfs/1202.3747v1.pdf,2012
1202.3748v1,"Conditional Restricted Boltzmann Machines for Structured Output
  Prediction",/Users/isabeldinan/01 Python/Info Retrieval/project/downloaded_pdfs/1202.3748v1.pdf,2012
1202.3750v1,Fractional Moments on Bandit Problems,/Users/isabeldinan/01 Python/Info Retrieval/project/downloaded_pdfs/1202.3750v1.pdf,2012
1202.3753v1,Partial Order MCMC for Structure Discovery in Bayesian Networks,/Users/isabeldinan/01 Python/Info Retrieval/project/downloaded_pdfs/1202.3753v1.pdf,2012
1202.3757v1,Identifiability of Causal Graphs using Functional Models,/Users/isabeldinan/01 Python/Info Retrieval/project/downloaded_pdfs/1202.3757v1.pdf,2012
1202.3758v1,"Nonparametric Divergence Estimation with Applications to Machine
  Learning on Distributions",/Users/isabeldinan/01 Python/Info Retrieval/project/downloaded_pdfs/1202.3758v1.pdf,2012
1202.3761v1,"New Probabilistic Bounds on Eigenvalues and Eigenvectors of Random
  Kernel Matrices",/Users/isabeldinan/01 Python/Info Retrieval/project/downloaded_pdfs/1202.3761v1.pdf,2012
1202.3763v1,"An Efficient Algorithm for Computing Interventional Distributions in
  Latent Variable Causal Models",/Users/isabeldinan/01 Python/Info Retrieval/project/downloaded_pdfs/1202.3763v1.pdf,2012
1202.3766v1,Robust learning Bayesian networks for prior belief,/Users/isabeldinan/01 Python/Info Retrieval/project/downloaded_pdfs/1202.3766v1.pdf,2012
1202.3769v1,Sparse matrix-variate Gaussian process blockmodels for network modeling,/Users/isabeldinan/01 Python/Info Retrieval/project/downloaded_pdfs/1202.3769v1.pdf,2012
1202.3770v1,Hierarchical Maximum Margin Learning for Multi-Class Classification,/Users/isabeldinan/01 Python/Info Retrieval/project/downloaded_pdfs/1202.3770v1.pdf,2012
1202.3771v1,Tightening MRF Relaxations with Planar Subproblems,/Users/isabeldinan/01 Python/Info Retrieval/project/downloaded_pdfs/1202.3771v1.pdf,2012
1202.3774v1,Risk Bounds for Infinitely Divisible Distribution,/Users/isabeldinan/01 Python/Info Retrieval/project/downloaded_pdfs/1202.3774v1.pdf,2012
1202.3775v1,"Kernel-based Conditional Independence Test and Application in Causal
  Discovery",/Users/isabeldinan/01 Python/Info Retrieval/project/downloaded_pdfs/1202.3775v1.pdf,2012
1202.3776v1,Smoothing Multivariate Performance Measures,/Users/isabeldinan/01 Python/Info Retrieval/project/downloaded_pdfs/1202.3776v1.pdf,2012
1202.3778v1,Sparse Topical Coding,/Users/isabeldinan/01 Python/Info Retrieval/project/downloaded_pdfs/1202.3778v1.pdf,2012
1202.3779v1,"Testing whether linear equations are causal: A free probability theory
  approach",/Users/isabeldinan/01 Python/Info Retrieval/project/downloaded_pdfs/1202.3779v1.pdf,2012
1202.4050v2,On the Sample Complexity of Predictive Sparse Coding,/Users/isabeldinan/01 Python/Info Retrieval/project/downloaded_pdfs/1202.4050v2.pdf,2012
1202.5514v2,"Classification approach based on association rules mining for unbalanced
  data",/Users/isabeldinan/01 Python/Info Retrieval/project/downloaded_pdfs/1202.5514v2.pdf,2012
1202.5598v4,Clustering using Max-norm Constrained Optimization,/Users/isabeldinan/01 Python/Info Retrieval/project/downloaded_pdfs/1202.5598v4.pdf,2012
1202.5695v2,Training Restricted Boltzmann Machines on Word Observations,/Users/isabeldinan/01 Python/Info Retrieval/project/downloaded_pdfs/1202.5695v2.pdf,2012
1202.6001v2,"Efficiently Sampling Multiplicative Attribute Graphs Using a
  Ball-Dropping Process",/Users/isabeldinan/01 Python/Info Retrieval/project/downloaded_pdfs/1202.6001v2.pdf,2012
1202.6078v1,Protocols for Learning Classifiers on Distributed Data,/Users/isabeldinan/01 Python/Info Retrieval/project/downloaded_pdfs/1202.6078v1.pdf,2012
1202.6228v6,"PAC-Bayesian Generalization Bound on Confusion Matrix for Multi-Class
  Classification",/Users/isabeldinan/01 Python/Info Retrieval/project/downloaded_pdfs/1202.6228v6.pdf,2012
1202.6504v2,Learning from Distributions via Support Measure Machines,/Users/isabeldinan/01 Python/Info Retrieval/project/downloaded_pdfs/1202.6504v2.pdf,2012
1203.0038v1,"Inference in Hidden Markov Models with Explicit State Duration
  Distributions",/Users/isabeldinan/01 Python/Info Retrieval/project/downloaded_pdfs/1203.0038v1.pdf,2012
1203.0203v1,"Fast Reinforcement Learning with Large Action Sets using
  Error-Correcting Output Codes for MDP Factorization",/Users/isabeldinan/01 Python/Info Retrieval/project/downloaded_pdfs/1203.0203v1.pdf,2012
1203.0683v3,A Method of Moments for Mixture Models and Hidden Markov Models,/Users/isabeldinan/01 Python/Info Retrieval/project/downloaded_pdfs/1203.0683v3.pdf,2012
1203.1596v2,Multiple Operator-valued Kernel Learning,/Users/isabeldinan/01 Python/Info Retrieval/project/downloaded_pdfs/1203.1596v2.pdf,2012
1203.2177v1,Regret Bounds for Deterministic Gaussian Process Bandits,/Users/isabeldinan/01 Python/Info Retrieval/project/downloaded_pdfs/1203.2177v1.pdf,2012
1203.2570v1,Differential Privacy for Functions and Functional Data,/Users/isabeldinan/01 Python/Info Retrieval/project/downloaded_pdfs/1203.2570v1.pdf,2012
1203.3461v1,Robust Metric Learning by Smooth Optimization,/Users/isabeldinan/01 Python/Info Retrieval/project/downloaded_pdfs/1203.3461v1.pdf,2012
1203.3462v1,Gaussian Process Topic Models,/Users/isabeldinan/01 Python/Info Retrieval/project/downloaded_pdfs/1203.3462v1.pdf,2012
1203.3468v1,Bayesian Rose Trees,/Users/isabeldinan/01 Python/Info Retrieval/project/downloaded_pdfs/1203.3468v1.pdf,2012
1203.3472v1,Super-Samples from Kernel Herding,/Users/isabeldinan/01 Python/Info Retrieval/project/downloaded_pdfs/1203.3472v1.pdf,2012
1203.3475v1,Inferring deterministic causal relations,/Users/isabeldinan/01 Python/Info Retrieval/project/downloaded_pdfs/1203.3475v1.pdf,2012
